{"$schema":"https://json-schema.org/draft/2020-12/schema","$id":"https://yula.local/schemas/handoff-brief.schema.json","title":"HandoffBrief","type":"object","additionalProperties":false,"required":["issue","spec","bounded_context","kind","status","branch","spec_worktree","objective","ubiquitous_language","invariants","decisions","implementation_state","changed_code","verification","active_lessons","open_loops","next_action","blockers","pending_hitl","updater","session","updated_at"],"properties":{"issue":{"type":"string","minLength":1},"spec":{"type":"string","minLength":1},"bounded_context":{"enum":["orchestration","agent-studio","tool-lab","knowledge","workspace","model-gateway","interaction","approval-security","integration","observability-cost","remote-access","identity-secrets"]},"kind":{"type":"string","minLength":1},"status":{"enum":["Todo","Progress","Review","Done"]},"branch":{"type":"string","minLength":1},"spec_worktree":{"type":"string","minLength":1},"objective":{"type":"string","minLength":1},"ubiquitous_language":{"type":"array","items":{"type":"string"}},"invariants":{"type":"array","items":{"type":"string"}},"decisions":{"type":"array","items":{"type":"string"}},"implementation_state":{"type":"string"},"changed_code":{"type":"array","items":{"type":"string"}},"verification":{"type":"array","items":{"type":"object","required":["command","result","observed_at"],"properties":{"command":{"type":"string"},"result":{"type":"string"},"observed_at":{"type":"string","format":"date-time"}}}},"active_lessons":{"type":"array","items":{"type":"string"}},"open_loops":{"type":"array","items":{"type":"string"}},"next_action":{"type":"string","minLength":1},"blockers":{"type":"array","items":{"type":"string"}},"pending_hitl":{"type":"array","items":{"type":"string"}},"updater":{"type":"string","minLength":1},"session":{"type":"string","minLength":1},"updated_at":{"type":"string","format":"date-time"}}}
