{
  "issue": "ArifMolon/yula#13",
  "spec": "SPEC-P0-domain-discovery",
  "bounded_context": "orchestration",
  "kind": "domain-discovery",
  "status": "Done",
  "branch": "spec/domain-discovery",
  "spec_worktree": ".worktrees/spec-domain-discovery",
  "objective": "Create the canonical end-to-end Event Storming record for tool onboarding, from discovery of a Tool candidate through isolated evaluation and ToolGrade publication to eligibility for use in an Execution.",
  "ubiquitous_language": [
    "Command",
    "Domain Event",
    "Policy",
    "Hotspot",
    "Tool",
    "ToolVersion",
    "DeclaredCapabilities",
    "EvaluationSuite",
    "ToolGrade",
    "ToolLabSession",
    "Evaluation artifact",
    "Execution",
    "Published Language"
  ],
  "invariants": [
    "Tool Lab owns isolated evaluation and ToolGrade publication.",
    "Orchestration consumes only the published ToolGrade contract and never reads Tool Lab internal models.",
    "A ToolVersion cannot become approved without license review and at least one successful EvaluationRun.",
    "A discovered Tool candidate cannot become automatically approved or eligible for an Execution.",
    "Every deterministic EvaluationSuite hard gate must pass before ToolGraded(approved) is published.",
    "Automatic approval creates no AgentBinding, CapabilityGrant, or Execution.",
    "Each evaluation case runs in a separate clean ToolLabSession and teardown must be verified.",
    "Deprecated ToolVersions cannot start new Executions; Agent Studio disables their bindings."
  ],
  "decisions": [
    "The product owner explicitly selected issue #13 as the next child of SPEC-P0-domain-discovery.",
    "Issue #13 is owned by the full Orchestration bounded-context name for delivery while the discovery must make Tool Lab, Integration, Agent Studio, Approval & Security, and Orchestration ownership boundaries explicit.",
    "The product owner validated the conversational Event Storming model section by section on 2026-07-13.",
    "The product owner explicitly accepted the written canonical Event Storming record on 2026-07-13 without requesting changes.",
    "No implementation, spec-to-main merge, push, or next-issue selection is authorized."
  ],
  "implementation_state": "Issue #13 is closed as completed and its GitHub Project status is Done. The accepted Event Storming record is committed on local main at 4c08593. Review evidence was recorded with no pending HITL, and scripts/spec-worktree finish-feature 13 returned the clean spec worktree to spec/domain-discovery and deleted feature/13-validate-tool-onboarding-domain-flow. The owning spec remains open and unmerged. No product code, real Tool evaluation, ToolGrade transition, push, or spec-to-main merge occurred.",
  "changed_code": [
    "my-docs/okf/event-storming/issue-13-tool-onboarding-domain-flow.md",
    "my-docs/okf/handoffs/issue-13.json"
  ],
  "verification": [
    {
      "command": "Live GitHub issue and Project query for ArifMolon/yula#13",
      "result": "PASS: issue OPEN and unblocked; Project Progress; Phase 0; Orchestration; R1; SPEC-P0-domain-discovery; Human Review Required; Size S",
      "observed_at": "2026-07-13T16:53:33Z"
    },
    {
      "command": "git -C .worktrees/spec-domain-discovery status --short --branch",
      "result": "PASS: feature/13-validate-tool-onboarding-domain-flow is active and the spec worktree is clean",
      "observed_at": "2026-07-13T16:53:33Z"
    },
    {
      "command": "node --test tests/*.test.mjs",
      "result": "PASS: 48 tests, 0 failures in the main checkout",
      "observed_at": "2026-07-13T16:54:06Z"
    },
    {
      "command": "node --test tests/*.test.mjs in .worktrees/spec-domain-discovery",
      "result": "PASS: 50 tests, 0 failures in the spec worktree",
      "observed_at": "2026-07-13T16:54:06Z"
    },
    {
      "command": "node scripts/validate-operating-model.mjs",
      "result": "PASS: 4 schema, 4 policy, 4 template, 2 resolved review",
      "observed_at": "2026-07-13T16:54:06Z"
    },
    {
      "command": "git diff --check",
      "result": "PASS: no whitespace errors",
      "observed_at": "2026-07-13T16:54:06Z"
    },
    {
      "command": "node --test tests/*.test.mjs",
      "result": "PASS: 48 tests, 0 failures in the main checkout after written-record acceptance",
      "observed_at": "2026-07-13T18:42:21Z"
    },
    {
      "command": "node --test tests/*.test.mjs in .worktrees/spec-domain-discovery",
      "result": "PASS: 50 tests, 0 failures",
      "observed_at": "2026-07-13T18:42:21Z"
    },
    {
      "command": "node scripts/validate-operating-model.mjs",
      "result": "PASS: 4 schema, 4 policy, 4 template, 2 resolved review",
      "observed_at": "2026-07-13T18:42:21Z"
    },
    {
      "command": "git diff --check --no-index /dev/null my-docs/okf/event-storming/issue-13-tool-onboarding-domain-flow.md",
      "result": "PASS: no whitespace errors in the accepted Event Storming record or HandoffBrief",
      "observed_at": "2026-07-13T18:42:21Z"
    },
    {
      "command": "Live GitHub Project query for ArifMolon/yula#13",
      "result": "PASS: Progress; Phase 0; Orchestration; R1; SPEC-P0-domain-discovery; Human Review Required; Size S",
      "observed_at": "2026-07-13T18:42:21Z"
    },
    {
      "command": "git show --stat --oneline --summary 4c08593",
      "result": "PASS: local main commit 4c08593 contains only the accepted issue #13 Event Storming record",
      "observed_at": "2026-07-13T18:45:16Z"
    },
    {
      "command": "node --test tests/*.test.mjs in main and .worktrees/spec-domain-discovery",
      "result": "PASS: 48 tests, 0 failures in main; 50 tests, 0 failures in the spec worktree",
      "observed_at": "2026-07-13T18:46:45Z"
    },
    {
      "command": "node scripts/validate-operating-model.mjs; HandoffBrief draft 2020-12 schema validation; git diff --check",
      "result": "PASS: 4 schema, 4 policy, 4 template, 2 resolved review; issue #13 HandoffBrief conforms; no whitespace errors",
      "observed_at": "2026-07-13T18:46:45Z"
    },
    {
      "command": "Live GitHub Project query for ArifMolon/yula#13",
      "result": "PASS: Review; Phase 0; Orchestration; R1; SPEC-P0-domain-discovery; Human Review Required; Size S",
      "observed_at": "2026-07-13T18:47:52Z"
    },
    {
      "command": "scripts/spec-worktree finish-feature 13 from .worktrees/spec-domain-discovery",
      "result": "PASS: switched to spec/domain-discovery; branch already up to date; deleted feature/13-validate-tool-onboarding-domain-flow at 95e8d30",
      "observed_at": "2026-07-13T18:47:52Z"
    },
    {
      "command": "Final node --test tests/*.test.mjs in main and .worktrees/spec-domain-discovery; operating-model/link validation; HandoffBrief schema; finish-state gates",
      "result": "PASS: 48 tests in main and 50 in the spec worktree with 0 failures; all document, schema, whitespace, clean-worktree, reviewed-feature, deleted-branch, and empty pending-HITL gates passed",
      "observed_at": "2026-07-13T18:49:13Z"
    },
    {
      "command": "Live GitHub issue and Project query for ArifMolon/yula#13",
      "result": "PASS: issue CLOSED as COMPLETED; Project Done; Phase 0; Orchestration; R1; SPEC-P0-domain-discovery; Human Review Required; Size S",
      "observed_at": "2026-07-13T18:49:13Z"
    }
  ],
  "active_lessons": [
    "lesson-delivery-patterns-are-not-domain-language"
  ],
  "open_loops": [
    "No next issue is selected; issue #14 must not start unless the product owner explicitly selects it."
  ],
  "next_action": "Ask the product owner to explicitly select the next in-scope work without starting issue #14 automatically.",
  "blockers": [],
  "pending_hitl": [],
  "updater": "codex",
  "session": "codex-2026-07-13-issue-13-delivery",
  "updated_at": "2026-07-13T18:49:13Z"
}
