{
  "issue": "ArifMolon/yula#12",
  "spec": "SPEC-P0-domain-discovery",
  "bounded_context": "orchestration",
  "kind": "domain-discovery",
  "status": "Progress",
  "branch": "feature/12-validate-task-execution-domain-flow",
  "spec_worktree": ".worktrees/spec-domain-discovery",
  "objective": "Create the canonical end-to-end Event Storming record for the task execution flow from user intent and Command through required approval to the observable Execution result.",
  "ubiquitous_language": [
    "Command",
    "Domain Event",
    "Policy",
    "Hotspot",
    "Execution",
    "ApprovalRequest",
    "Published Language"
  ],
  "invariants": [
    "The flow names every actor, Command, past-tense Domain Event, Policy, and Hotspot from intent through result.",
    "Orchestration ownership and every cross-context Published Language interaction are explicit.",
    "Ownership conflicts are recorded as Hotspots with evidence and a proposed resolution path.",
    "The canonical Event Storming record is owned by the main checkout under my-docs/okf/event-storming."
  ],
  "decisions": [
    "Domain-facing child issue titles use the Domain Discovery work kind; tracer bullet remains a delivery pattern only.",
    "Issue #12 is the only selected dependency-frontier issue in this spec worktree.",
    "Product-owner review is required after the issue #12 Event Storming record is drafted and before the issue can become Done."
  ],
  "implementation_state": "Issue #12 is selected and its feature branch is active. Domain Discovery has not begun. Commit 95e8d30 on the spec branch repaired sparse-worktree baseline validation and worktree-local pnpm configuration before feature start.",
  "changed_code": [
    "scripts/spec-worktree",
    "scripts/repository-paths.mjs",
    "scripts/validate-operating-model.mjs",
    "tests/agent-instructions.test.mjs",
    "tests/operating-model.test.mjs",
    "tests/repository-paths.test.mjs",
    "tests/worktree-policy.test.mjs"
  ],
  "verification": [
    {
      "command": "node --test tests/*.test.mjs",
      "result": "PASS: 50 tests, 0 failures in .worktrees/spec-domain-discovery at commit 95e8d30",
      "observed_at": "2026-07-13T03:47:38Z"
    },
    {
      "command": "node scripts/validate-operating-model.mjs",
      "result": "PASS: 4 schema, 4 policy, 4 template, 2 resolved review.",
      "observed_at": "2026-07-13T03:47:38Z"
    },
    {
      "command": "git diff --check",
      "result": "PASS: no whitespace errors",
      "observed_at": "2026-07-13T03:47:38Z"
    },
    {
      "command": "GitHub Project item query for ArifMolon/yula#12",
      "result": "Progress; Phase 0; Orchestration; R1; SPEC-P0-domain-discovery; Human Review Required; Size S",
      "observed_at": "2026-07-13T03:47:38Z"
    }
  ],
  "active_lessons": [],
  "open_loops": [
    "Confirm the complete actor set for user intent, approval, execution, runtime, and observation.",
    "Name the intent-expressing Commands and past-tense Domain Events without inventing synonyms outside the Orchestration Ubiquitous Language.",
    "Make the Policies, Hotspots, Published Language boundaries, and context ownership conflicts explicit.",
    "Define the evidence and review artifact the product owner will use to accept the issue #12 Event Storming record."
  ],
  "next_action": "Conduct the issue #12 Domain Discovery session with the product owner to resolve actors, Commands, Domain Events, Policies, Hotspots, Published Language boundaries, and review evidence before drafting the canonical Event Storming record.",
  "blockers": [
    "The issue #12 domain flow contract is not yet explicit enough to draft canonically without product-owner input."
  ],
  "pending_hitl": [
    "Product-owner review of the completed issue #12 Event Storming record is required before Review can transition to Done; no approval decision has been requested or recorded yet."
  ],
  "updater": "codex",
  "session": "codex-2026-07-13-spec-1-issue-12",
  "updated_at": "2026-07-13T03:47:38Z"
}
